{
  "schema": { "name": "mochawesome-report", "version": "8.0.0-alpha.0" },
  "meta": {
    "generatedAt": "2025-01-01T00:00:00.000Z",
    "durationMs": 0,
    "runner": { "name": "mocha", "version": "0.0.0" },
    "reporter": { "name": "mochawesome", "version": "8.0.0-alpha.0" },
    "output": {
      "reportDir": "mochawesome-report",
      "htmlFile": "mochawesome.html",
      "jsonFile": "mochawesome.json",
      "assetsDir": "assets",
      "assetMode": "inline",
      "attachmentMode": "link"
    }
  },
  "stats": {
    "suites": 0,
    "tests": 0,
    "passes": 0,
    "failures": 0,
    "pending": 0,
    "skipped": 0,
    "start": "2025-01-01T00:00:00.000Z",
    "end": "2025-01-01T00:00:00.000Z",
    "durationMs": 0
  },
  "rootSuite": {
    "id": "s0",
    "title": "",
    "fullTitle": "",
    "timing": {
      "start": "2025-01-01T00:00:00.000Z",
      "end": "2025-01-01T00:00:00.000Z",
      "durationMs": 0
    },
    "suites": [],
    "tests": [],
    "hooks": []
  }
}
